{
  "candles": [
    {
      "candle_close_time": 1793318400000,
      "candle_open_time": 1793317500000,
      "close": "30.0",
      "confirm": true,
      "high": "30.15",
      "inst_id": "AVAX-USDT-SWAP",
      "low": "29.85",
      "open": "29.94",
      "timeframe": "15m",
      "vol_base": "1000.0",
      "vol_quote": "30000.0"
    },
    {
      "candle_close_time": 1793319300000,
      "candle_open_time": 1793318400000,
      "close": "30.1605",
      "confirm": true,
      "high": "30.3113",
      "inst_id": "AVAX-USDT-SWAP",
      "low": "30.0097",
      "open": "30.1001",
      "timeframe": "15m",
      "vol_base": "1000.0",
      "vol_quote": "30160.46"
    },
    {
      "candle_close_time": 1793320200000,
      "candle_open_time": 1793319300000,
      "close": "30.1817",
      "confirm": true,
      "high": "30.3326",
      "inst_id": "AVAX-USDT-SWAP",
      "low": "30.0308",
      "open": "30.1213",
      "timeframe": "15m",
      "vol_base": "1000.0",
      "vol_quote": "30181.67"
    },
    {
      "candle_close_time": 1793321100000,
      "candle_open_time": 1793320200000,
      "close": "30.0524",
      "confirm": true,
      "high": "30.2027",
      "inst_id": "AVAX-USDT-SWAP",
      "low": "29.9021",
      "open": "29.9923",
      "timeframe": "15m",
      "vol_base": "1000.0",
      "vol_quote": "30052.4"
    },
    {
      "candle_close_time": 1793322000000,
      "candle_open_time": 1793321100000,
      "close": "29.8998",
      "confirm": true,
      "high": "30.0493",
      "inst_id": "AVAX-USDT-SWAP",
      "low": "29.7503",
      "open": "29.84",
      "timeframe": "15m",
      "vol_base": "1000.0",
      "vol_quote": "29899.78"
    },
    {
      "candle_close_time": 1793322900000,
      "candle_open_time": 1793322000000,
      "close": "29.8724",
      "confirm": true,
      "high": "30.0218",
      "inst_id": "AVAX-USDT-SWAP",
      "low": "29.723",
      "open": "29.8126",
      "timeframe": "15m",
      "vol_base": "1000.0",
      "vol_quote": "29872.39"
    },
    {
      "candle_close_time": 1793323800000,
      "candle_open_time": 1793322900000,
      "close": "30.0037",
      "confirm": true,
      "high": "30.1537",
      "inst_id": "AVAX-USDT-SWAP",
      "low": "29.8537",
      "open": "29.9437",
      "timeframe": "15m",
      "vol_base": "1000.0",
      "vol_quote": "30003.71"
    },
    {
      "candle_close_time": 1793324700000,
      "candle_open_time": 1793323800000,
      "close": "30.1813",
      "confirm": true,
      "high": "30.3322",
      "inst_id": "AVAX-USDT-SWAP",
      "low": "30.0304",
      "open": "30.1209",
      "timeframe": "15m",
      "vol_base": "1000.0",
      "vol_quote": "30181.26"
    },
    {
      "candle_close_time": 1793325600000,
      "candle_open_time": 1793324700000,
      "close": "30.2501",
      "confirm": true,
      "high": "30.4013",
      "inst_id": "AVAX-USDT-SWAP",
      "low": "30.0988",
      "open": "30.1896",
      "timeframe": "15m",
      "vol_base": "1000.0",
      "vol_quote": "30250.08"
    },
    {
      "candle_close_time": 1793326500000,
      "candle_open_time": 1793325600000,
      "close": "30.1552",
      "confirm": true,
      "high": "30.306",
      "inst_id": "AVAX-USDT-SWAP",
      "low": "30.0044",
      "open": "30.0949",
      "timeframe": "15m",
      "vol_base": "1000.0",
      "vol_quote": "30155.18"
    },
    {
      "candle_close_time": 1793327400000,
      "candle_open_time": 1793326500000,
      "close": "29.9921",
      "confirm": true,
      "high": "30.142",
      "inst_id": "AVAX-USDT-SWAP",
      "low": "29.8421",
      "open": "29.9321",
      "timeframe": "15m",
      "vol_base": "1000.0",
      "vol_quote": "29992.08"
    },
    {
      "candle_close_time": 1793328300000,
      "candle_open_time": 1793327400000,
      "close": "29.919",
      "confirm": true,
      "high": "30.0686",
      "inst_id": "AVAX-USDT-SWAP",
      "low": "29.7694",
      "open": "29.8592",
      "timeframe": "15m",
      "vol_base": "1000.0",
      "vol_quote": "29919.0"
    },
    {
      "candle_close_time": 1793329200000,
      "candle_open_time": 1793328300000,
      "close": "30.0114",
      "confirm": true,
      "high": "30.1615",
      "inst_id": "AVAX-USDT-SWAP",
      "low": "29.8614",
      "open": "29.9514",
      "timeframe": "15m",
      "vol_base": "1000.0",
      "vol_quote": "30011.42"
    },
    {
      "candle_close_time": 1793330100000,
      "candle_open_time": 1793329200000,
      "close": "30.1926",
      "confirm": true,
      "high": "30.3436",
      "inst_id": "AVAX-USDT-SWAP",
      "low": "30.0417",
      "open": "30.1322",
      "timeframe": "15m",
      "vol_base": "1000.0",
      "vol_quote": "30192.63"
    },
    {
      "candle_close_time": 1793331000000,
      "candle_open_time": 1793330100000,
      "close": "30.3043",
      "confirm": true,
      "high": "30.4558",
      "inst_id": "AVAX-USDT-SWAP",
      "low": "30.1528",
      "open": "30.2437",
      "timeframe": "15m",
      "vol_base": "1000.0",
      "vol_quote": "30304.31"
    },
    {
      "candle_close_time": 1793331900000,
      "candle_open_time": 1793331000000,
      "close": "30.2521",
      "confirm": true,
      "high": "30.4033",
      "inst_id": "AVAX-USDT-SWAP",
      "low": "30.1008",
      "open": "30.1915",
      "timeframe": "15m",
      "vol_base": "1000.0",
      "vol_quote": "30252.05"
    },
    {
      "candle_close_time": 1793332800000,
      "candle_open_time": 1793331900000,
      "close": "30.0922",
      "confirm": true,
      "high": "30.2426",
      "inst_id": "AVAX-USDT-SWAP",
      "low": "29.9417",
      "open": "30.032",
      "timeframe": "15m",
      "vol_base": "1000.0",
      "vol_quote": "30092.18"
    },
    {
      "candle_close_time": 1793333700000,
      "candle_open_time": 1793332800000,
      "close": "29.9799",
      "confirm": true,
      "high": "30.1298",
      "inst_id": "AVAX-USDT-SWAP",
      "low": "29.83",
      "open": "29.92",
      "timeframe": "15m",
      "vol_base": "1000.0",
      "vol_quote": "29979.95"
    },
    {
      "candle_close_time": 1793334600000,
      "candle_open_time": 1793333700000,
      "close": "30.0268",
      "confirm": true,
      "high": "30.177",
      "inst_id": "AVAX-USDT-SWAP",
      "low": "29.8767",
      "open": "29.9668",
      "timeframe": "15m",
      "vol_base": "1000.0",
      "vol_quote": "30026.82"
    },
    {
      "candle_close_time": 1793335500000,
      "candle_open_time": 1793334600000,
      "close": "30.198",
      "confirm": true,
      "high": "30.349",
      "inst_id": "AVAX-USDT-SWAP",
      "low": "30.047",
      "open": "30.1376",
      "timeframe": "15m",
      "vol_base": "1000.0",
      "vol_quote": "30197.98"
    },
    {
      "candle_close_time": 1793336400000,
      "candle_open_time": 1793335500000,
      "close": "30.3443",
      "confirm": true,
      "high": "30.4961",
      "inst_id": "AVAX-USDT-SWAP",
      "low": "30.1926",
      "open": "30.2836",
      "timeframe": "15m",
      "vol_base": "1000.0",
      "vol_quote": "30344.33"
    },
    {
      "candle_close_time": 1793337300000,
      "candle_open_time": 1793336400000,
      "close": "30.3396",
      "confirm": true,
      "high": "30.4913",
      "inst_id": "AVAX-USDT-SWAP",
      "low": "30.1879",
      "open": "30.2789",
      "timeframe": "15m",
      "vol_base": "1000.0",
      "vol_quote": "30339.6"
    },
    {
      "candle_close_time": 1793338200000,
      "candle_open_time": 1793337300000,
      "close": "30.1964",
      "confirm": true,
      "high": "30.3474",
      "inst_id": "AVAX-USDT-SWAP",
      "low": "30.0454",
      "open": "30.136",
      "timeframe": "15m",
      "vol_base": "1000.0",
      "vol_quote": "30196.41"
    },
    {
      "candle_close_time": 1793339100000,
      "candle_open_time": 1793338200000,
      "close": "30.0547",
      "confirm": true,
      "high": "30.205",
      "inst_id": "AVAX-USDT-SWAP",
      "low": "29.9044",
      "open": "29.9946",
      "timeframe": "15m",
      "vol_base": "1000.0",
      "vol_quote": "30054.68"
    },
    {
      "candle_close_time": 1793340000000,
      "candle_open_time": 1793339100000,
      "close": "30.053",
      "confirm": true,
      "high": "30.2033",
      "inst_id": "AVAX-USDT-SWAP",
      "low": "29.9027",
      "open": "29.9929",
      "timeframe": "15m",
      "vol_base": "1000.0",
      "vol_quote": "30053.0"
    },
    {
      "candle_close_time": 1793340900000,
      "candle_open_time": 1793340000000,
      "close": "30.2012",
      "confirm": true,
      "high": "30.3522",
      "inst_id": "AVAX-USDT-SWAP",
      "low": "30.0502",
      "open": "30.1408",
      "timeframe": "15m",
      "vol_base": "1000.0",
      "vol_quote": "30201.18"
    },
    {
      "candle_close_time": 1793341800000,
      "candle_open_time": 1793340900000,
      "close": "30.3713",
      "confirm": true,
      "high": "30.5231",
      "inst_id": "AVAX-USDT-SWAP",
      "low": "30.2194",
      "open": "30.3105",
      "timeframe": "15m",
      "vol_base": "1000.0",
      "vol_quote": "30371.26"
    },
    {
      "candle_close_time": 1793342700000,
      "candle_open_time": 1793341800000,
      "close": "30.4151",
      "confirm": true,
      "high": "30.5672",
      "inst_id": "AVAX-USDT-SWAP",
      "low": "30.2631",
      "open": "30.3543",
      "timeframe": "15m",
      "vol_base": "1000.0",
      "vol_quote": "30415.15"
    },
    {
      "candle_close_time": 1793343600000,
      "candle_open_time": 1793342700000,
      "close": "30.3008",
      "confirm": true,
      "high": "30.4523",
      "inst_id": "AVAX-USDT-SWAP",
      "low": "30.1493",
      "open": "30.2402",
      "timeframe": "15m",
      "vol_base": "1000.0",
      "vol_quote": "30300.76"
    },
    {
      "candle_close_time": 1793344500000,
      "candle_open_time": 1793343600000,
      "close": "30.1415",
      "confirm": true,
      "high": "30.2923",
      "inst_id": "AVAX-USDT-SWAP",